Latitude,Longitude,Platform Num,Road,Routes
172.4676911,-43.64270682,11062,Lincoln University,80|820
172.5704188,-43.58440294,33883,Halswell Rd near Village Lane,100
172.5716738,-43.51360488,10878,Waimairi Rd near Wentworth St,Or
172.604431,-43.49543488,37489,Harewood Rd near Matsons Ave,125|28|Or
172.6748865,-43.53199042,11164,Eastgate Mall (Buckleys Rd),140|80|Or|Y
172.5884566,-43.2951189,53982,Enverton Dr near Kingsbury Av,B
172.6832285,-43.54307148,23274,Hargood St near Clydesdale St,155
172.5919908,-43.51859929,41348,Fendalton,29
172.554027,-43.52631063,24996,Yaldhurst Rd near Racecourse Rd,140|86
172.6723727,-43.55804048,42182,Opawa Rd near Mary Mclean Pl,28
172.7107,-43.28701955,44652,Waikuku Beach Rd near Kaiapohia Rd,95
172.70257,-43.47491594,20958,Broadhaven Ave near Inwoods Rd,O
172.6293527,-43.44948203,12941,Main North Rd near Belfast Rd,95|B
172.5668215,-43.52046024,13038,Solway Ave near Glenside Ave,130
172.6794462,-43.52839812,11172,Buckleys Rd near Butterfield Ave,155|80|Or|Y
172.7155844,-43.56553526,32179,Major Hornbrook Rd near Freeman St,140
172.5867735,-43.50562357,10639,Clyde Rd near Morley St,120
172.7438557,-43.54209444,43117,Rocking Horse Rd near Heron St,60
172.5351286,-43.51882619,24299,Russley Rd near Dinton St,125|140
172.6826429,-43.56840681,42078,Port Hills Rd near Avoca Valley Rd,28
172.6633643,-43.54449968,11563,Ensors Rd near Grenville St,Or
172.6007841,-43.4761926,19831,Claridges Rd near Opal Pl,28
172.6228891,-43.51383951,12505,Papanui Rd near St Albans St,95|B
172.680282,-43.5664261,42294,Port Hills Rd near Nuttall Dr,28
172.6664578,-43.3402838,12289,Main North Rd near Sandhill Rd,95
172.7627119,-43.57158343,30642,Nayland St near Hardwicke St,P
172.5795111,-43.52745835,38317,Ilam Rd near Kirkwood Ave,100|P
172.664011,-43.525282,51055,Woodham Rd near Brittan St,Or
172.5364366,-43.53290129,25035,Buchanans Rd near Cicada Pl,130
172.6488353,-43.3988675,15873,Main North Rd near Neeves Rd,95|B
172.585938,-43.543553,50604,Birmingham Dr near Craft Pl,140
172.7256799,-43.50694474,39383,Hawke St near Fenners Ln,60
172.7139062,-43.51216539,26638,Pages Rd near Farnborough St,Y
172.5929505,-43.28972626,44014,Ashley St near River Rd,B
172.6211818,-43.55921435,22314,Barrington St near Strauss Pl,45
172.6812672,-43.52558448,11186,Kerrs Rd,80|Or
172.6807854,-43.54554141,23261,Hargood St near Oban Pl,155
172.5265,-43.5464,38262,Amyes Rd near Shands Rd,125
172.6955,-43.3048,54370,Lakeside Dr near Tiritiri Moana Dr,95
172.6693378,-43.53718861,11206,Aldwins Rd near Harrow St,140|80|Or
172.6626229,-43.50665731,13283,The Palms (Marshland Rd- vet side),60
172.6946304,-43.57195099,42066,Port Hills Rd near Horotane Valley Rd,28
172.7364755,-43.55995489,28824,Main Rd near Celia St,P
172.683733,-43.500046,53377,Lake Tce Rd near New Brighton Rd,60|O
172.327836,-43.747833,53821,Doyleston,87
172.6598884,-43.51490998,13310,North Pde near Medway St,60|Or
172.6216592,-43.46041736,15991,Northwood Blvd near Main North Rd,107|28
172.6145782,-43.50420744,12892,Papanui Rd near Tomes Rd,95|B
172.6356167,-43.58110642,23495,Cashmere ,B
172.6853006,-43.5328553,23014,Hay St near Kuaka Cres,155
172.6824543,-43.48638764,13745,Burwood Rd near Helmsdale St,O
172.6263938,-43.57735537,23219,Hackthorne Rd near Stambridge Pl,B
172.6460218,-43.51140795,38496,Barbadoes St near Edward Ave,100|44
172.5657433,-43.53309389,11027,Main South Rd near English St,100|130|87|Y
172.554316,-43.5163924,10246,Maidstone Rd near Derenzy Pl,P
172.5806777,-43.48484301,19416,Harewood Rd near Gardiners Rd,125|28
172.7322815,-43.55686341,42452,Main Rd near Beachville Rd,P
172.650416,-43.52028602,20595,Whitmore St near Bealey Ave,O
172.5173683,-43.537289,14817,Gilberthorpes Rd near Prichard Cres,130
172.5700861,-43.59084537,33999,Halswell,100
172.6115819,-43.52665114,10116,Kilmarnock St near Deans Ave,130
172.6966975,-43.55325698,45099,Charlesworth St near Ti Rakau Dr,140
172.6904563,-43.60205899,41136,Governors Bay Rd near Mariners Cv,28
172.676554,-43.53064789,11299,Buckleys Rd near Rhona St,155|80|Or|Y
172.624372,-43.571846,23154,Hackthorne Rd near Cashmere Rd,B
172.5895319,-43.48001013,16679,Sawyers Arms Rd near Cotswold Ave,107|28
172.7080813,-43.58227718,42406,Bridle Path Rd near Port Hills Rd,155|28
172.6481031,-43.54737431,32758,Defoe Pl,28
172.717612,-43.5598426,36203,Major Hornbrook Rd near St Andrews Hill Rd,140
172.6296804,-43.44947542,15357,Main North Rd near Belfast Rd,95|B
172.560636,-43.555075,54097,Skyhawk near Kittyhawk Avenue,60
172.6458316,-43.50904711,38483,Warrington St Shops,100|44
172.3858732,-43.58714433,50367,Jones Rd near Hoskyns Rd,Y
172.67156,-43.534654,11309,Aldwins Rd near Marlborough St,140|80|Or
172.617217,-43.521526,16362,Rossall St near Rhodes St,17
172.5224793,-43.54227323,11500,The Hub Hornby,125|130|140|87|Y
172.623232,-43.56123519,22474,Barrington St near Conway St,45
172.5870539,-43.52895201,38757,Clyde Rd near Totara St,100|120
172.610786,-43.493196,39641,Northlands Platform A,107|95|B
172.7102404,-43.55815106,36242,Main Rd near St Andrews Hill Rd,P
172.6958,-43.3044,54389,Tiritiri Moana Dr near Lakeside Dr,95
172.5815563,-43.48229257,16651,Gardiners Rd near St Ives St,28
172.6515628,-43.51392272,32581,Hills Rd near Dudley St,O
172.6466804,-43.55048754,32801,Waltham Rd near Austin St,17
172.3764178,-43.51556322,54508,Halkett Rd near Rossington Dr,86
172.7308445,-43.51056705,26471,Oram Ave near Hood St,60
172.5433923,-43.51976178,24544,Bentley St near Cutts Rd,125|140
172.5777804,-43.51061618,37721,Memorial Ave near Hampton Pl,29
172.589682,-43.30005963,44623,King St near Seddon St,B
172.6452627,-43.51347528,38340,Edgeware Rd near Packe St,100
172.552388,-43.517262,50708,Withells Rd near Woodbury St,125
172.658068,-43.51766281,18578,N Avon Rd near Tweed St,60|Or
172.5668199,-43.5795833,,Halswell Shops,120|125|130|140|820|P|Y
172.6383907,-43.51022804,41877,Cranford St near Winton St,28
172.661626,-43.52516,51029,Woodham Rd near Avonside Dr,Or
172.552805,-43.554486,51539,The Runway near Kittyhawk Ave,100
172.5073985,-43.51254049,53799,Yaldhurst,86
172.29863,-43.616364,,Burnham,120|125|130|140|820|P|Y
172.624552,-43.57409675,32024,Hackthorne Rd near Gwynfa Ave,B
172.6553461,-43.4972825,24186,Emmett St near Bellbrook Cres,44
172.7117051,-43.60336984,41831,Brittan Tce near Voelas Rd,28
172.7162995,-43.56937725,28443,Major Hornbrook Rd near Belleview Tce,140
172.55635,-43.553409,53440,Corsair Dr - The Landing,60
172.716915,-43.56577451,32167,Major Hornbrook Rd near Muritai Tce,140
172.7294272,-43.50300059,12145,Marine Pde near Lonsdale St,135
172.653231,-43.5081475,39710,Shirley Rd near Slater St,100|O|Or
172.699446,-43.480777,51659,Inwoods Rd near Jade Pl,O
172.6263949,-43.45411369,12788,Main North Rd near Lagan St,95|B
172.5561106,-43.51082709,10214,Avonhead Mall,125|P
172.5597524,-43.53479255,25429,Craven St near Algidus St,130
172.6846998,-43.55028407,15582,Ferry Rd near Catherine St,P
172.644458,-43.52991,46133,Gloucester St near Barbadoes St,O|Y
172.6261569,-43.4787452,29937,Daniels Rd near Rathlin St,125
172.5981441,-43.52503828,13231,Kahu Rd near Girvan St,130
172.7211523,-43.49170175,21791,Effingham St near Surfers Pl,135
172.5940582,-43.31850444,26601,South Blt near King St,B
172.6757223,-43.55026695,23870,Radley St near Tavender St,155
172.547206,-43.54263177,11977,Harvard Ave and Main South Rd,100|80|87|Y
172.5920425,-43.52214248,10061,Kotare St near Medbury Tce,130
172.507291,-43.543477,45892,Halswell Junction Rd near Foremans Rd,Y
172.5934428,-43.48117724,19087,Highsted Rd,28
172.694715,-43.572189,42169,Port Hills Rd near Horotane Valley Rd,28
172.7300833,-43.5138348,40254,Rodney St near Union St,60
172.6569705,-43.52385238,40644,Stanmore Rd near Draper St,60|Or
172.710584,-43.57574661,42111,Heathcote,28
172.6757293,-43.56224578,40040,Port Hills Rd near Curries Rd,28
172.7186617,-43.48628021,12132,Beach Rd near Britannia St,80
172.5739511,-43.49288249,16554,Wairakei Rd near Breens Rd,17
172.6152681,-43.4583976,15970,Northwood,28
172.5846314,-43.29197435,54679,Enverton Dr near Grosvenor Lane,B
172.593892,-43.29353874,44261,Ashley St near Rickton Pl,B
172.6620672,-43.50094089,12243,Marshland Rd near Joy St,135|60
172.7567205,-43.56683143,42577,Marriner St near Main Rd,P
172.6586595,-43.54021516,44183,Ferry Rd near Phillipstown Cts,140|P
172.6458562,-43.51544123,24814,Barbadoes St near Canon St,44
172.654416,-43.56466949,32864,Ramahana Rd near Aotea Tce,17
172.385204,-43.613504,52785,Dynes Rd near Faringdon Blvd,820|85
172.7412091,-43.53859267,26311,Caspian St near Rocking Horse Rd,60
172.6322306,-43.51174011,38522,Springfield Rd near Kinloch St,100
172.5961094,-43.5246741,13220,Kotare St near Kahu Rd,130
172.7417989,-43.56500981,28848,Main Rd near Wakatu Ave,P
172.6525402,-43.56668913,32935,Huntsbury Ave,17
172.5695177,-43.49005294,16499,Wairakei Rd near Abros Pl,17
172.6834442,-43.48881684,18005,Burwood Rd near Newhaven St,O
172.5731195,-43.53198207,38871,Church Corner,100|130|140|86|87|Y
172.7126597,-43.48635652,13713,Beach Rd near Bower Ave,135|80
172.5679679,-43.58095554,33865,Halswell Rd near Nicholls Rd,100
172.5484981,-43.51087598,10365,Kedleston Dr near Audley Gate,130
172.5699404,-43.58411428,22276,Halswell Rd near Village Lane,100|125
172.6110564,-43.47083859,29327,Regent's Park Dr near Primrose Hill Ln,28
172.7163718,-43.48629228,13721,Beach Rd near Effingham St,135|80
172.6530599,-43.55486008,11954,St Martins Rd near Wilding St,Or
172.6488766,-43.52989348,14024,Fitzgerald Ave,O|Y
172.6860089,-43.57031762,42097,Port Hills Rd near Vega Pl,28
172.6172853,-43.45935231,43210,Northwood Blvd near Mounter Ave,28
172.6948134,-43.54903286,41087,Ti Rakau Dr near Shearwater Dr,140
172.5270088,-43.53026473,14599,Hei Hei Rd near Buchanans Rd,130
172.546373,-43.577592,53591,Longhurst Medical Centre,O
172.589884,-43.312423,51306,Bush St near Watson Pl,B
172.6263826,-43.47864036,29985,Daniels Rd near Inca Pl,125
172.6654544,-43.49464893,18634,Lake Terrace Rd near Fairway Dr,60
172.6337451,-43.55060521,33162,Milton St near Antrim St,45
172.6782308,-43.50540948,39320,New Brighton Rd near Queensbury St,O
172.6217372,-43.5448289,33655,Selwyn St near Fairfield Ave,60
172.606105,-43.48127182,17380,Veitches Rd near Cavendish Rd,107
172.6224864,-43.53732207,14114,Christchurch Hospital (Hagley Ave),60|80|O
172.6061134,-43.48365916,19975,Cavendish Rd near Northcote Rd,107
172.6356826,-43.53646878,14263,St Asaph St near Colombo St,60|80|86|87|O|P|Y
172.6477038,-43.49537022,32076,Innes Rd near Hills Rd,44|Or
172.5815299,-43.50459049,39673,Greers Rd near Clyde Rd,120|Or
172.557485,-43.52738129,24805,Yaldhurst Rd near Bucknell St,140|86
172.3126806,-43.61269202,50211,Aylesbury Rd near Runners Rd,820
172.6301816,-43.53648729,14271,St Asaph St near Montreal St,60|80|86|87|O|P|Y
172.6088896,-43.45899601,40784,Hussey Rd,107
172.6167393,-43.47723289,13347,Main North Rd near Manse Pl,95|B
172.6515971,-43.51637746,20152,Hills Rd near Gresford St,O
172.6462934,-43.56791377,11908,Centaurus Rd near Whaka Tce,Or
172.6265291,-43.55369337,29050,Selwyn St near Dobson St,60
172.6647855,-43.35463681,15839,Main North Rd near Lees Rd,95
172.2984451,-43.61618237,17834,Burnham,820
172.6451847,-43.53644889,14665,St Asaph St near Barbadoes St,80
172.7604482,-43.5704102,42531,Nayland St near Stoke St,P
172.5723122,-43.51789708,13055,Waimairi Rd near Maydell St,130|Or
172.5644865,-43.48916359,16475,Wairakei Rd near Sheffield Cres,17|P
172.6096929,-43.55782671,22194,Lyttelton St near Glynne Cres,120
172.6571486,-43.53136283,53562,Stanmore Rd near Worcester St,60
172.4680162,-43.55635307,50253,Jones Rd (Templeton),Y
172.7318418,-43.52110938,26542,Estuary Rd near Bellamy Ave,60
172.6369774,-43.56023019,32011,Colombo St near Fisher Ave,B
172.6375565,-43.50804742,29362,Cranford St near Berwick St,28
172.346275,-43.595408,52728,Two Chain Rd near Walkers Rd,820
172.6926163,-43.52227366,40306,Pages Rd near Ottawa Rd,Y
172.7213001,-43.56399285,30880,Soleares Ave near Santa Maria Ave,140
172.7088296,-43.56375903,42327,Bridle Path Rd near Ferrymead Park Dr,155
172.7107741,-43.57149743,42389,Bridle Path Rd near Hammerton Ln,155
172.6774661,-43.52512144,36862,Woodham Rd near Carnarvon St,Or
172.5962744,-43.55984359,33143,Mathers Rd near Waters St,60
172.5741003,-43.4996463,10493,Cranbrook Ave near Appleby Cres,120
172.385599,-43.593482,17997,Rolleston Dr near Lincoln Rolleston Rd,Y
172.6065952,-43.56185833,33094,Hoon Hay Rd near Maryhill Ave,60
172.6460355,-43.51553276,24402,Barbadoes St near Canon St,44
172.6564289,-43.5180271,40628,Stanmore Rd near Siddal Pl,60|Or
172.6739898,-43.55236679,23453,Radley St near Chichester St,155
172.6361311,-43.3803107,53331,Silverstream,B
172.3856738,-43.59871516,17783,Tennyson St near Michelangelo Dr,820|85|Y
172.6970459,-43.4717336,20507,Broadhaven Ave near Queenspark Dr,O
172.581081,-43.48524,42857,Harewood Rd near Breens Rd,125|28
172.6497274,-43.53644452,14677,St Asaph St near Fitzgerald Ave,80
172.6162497,-43.53146089,14715,Riccarton Ave,80|86|87|P|Y
172.6121187,-43.56000413,22295,Lyttelton St near Hennessy Pl,120
172.618638,-43.50885617,12987,Papanui Rd near Heaton St,95|B
172.6036856,-43.5093497,16260,Wairakei Rd near Idris Rd,17
172.5960322,-43.53309375,28587,Matipo St near Peverel St,140
172.6100207,-43.52890847,17207,Riccarton Rd near Bartlett St,130|80|86|87|P|Y
172.6365091,-43.51870532,19376,Colombo St near Purchas St,28
172.6392153,-43.3840467,53417,Island Rd near Barnard St,B
172.619168,-43.539853,36022,Moorhouse Ave near Hagley Ave,140|O
172.6975569,-43.49314934,39061,Travis Rd near Travis Country Dr,60
172.6615218,-43.49339909,46903,Marshland Rd,135
172.7351919,-43.5589586,28807,Main Rd near Raekura Pl,P
172.5714394,-43.49118421,16633,Wairakei Rd near Todd Ave,17
172.3885064,-43.61661917,54045,Faringdon (Blvd),85
172.6202011,-43.53331362,17224,Riccarton Ave near Hagley Ave,80|86|87|P|Y
172.6957046,-43.48045453,18652,Mairehau Rd near Daytona Pl,135|O
172.6223949,-43.53396895,17230,Christchurch Hospital ( Ricc Ave),80|86|87|P|Y
172.5395569,-43.54307398,38956,Main South Rd near Garvins Rd,87|Y
172.6508297,-43.52553683,28491,Fitzgerald Ave near River Rd,O
172.6263837,-43.51839083,12742,Papanui Rd near Clare Rd,95|B
172.6503373,-43.52280729,28784,Fitzgerald Ave near Alexandra St,O
172.7503419,-43.55644706,26213,Southshore,60
172.6280655,-43.52538923,14743,Park Tce near Peterborough St,17
172.664894,-43.525165,51038,Woodham Rd near Patten St,Or
172.6275417,-43.52950334,53185,Rolleston Ave near Gloucester St,17
172.6204568,-43.53322367,17248,Riccarton Ave near Hagley Ave,80|86|87|P|Y
172.378743,-43.584136,52759,Link Dve,820
172.6464836,-43.40591385,12340,Main North Rd near Doubledays Rd,95|B
172.6622128,-43.37936044,15012,Williams St near Davie St,95
172.627835,-43.543128,29468,Antigua St near Disraeli St,120
172.567916,-43.59109437,33981,Halswell Rd near O'halloran Dr,100
172.5552153,-43.51266992,10320,Withells Rd near Apsley Dr,125|P
172.566879,-43.57025123,25866,Dunbars Rd near Balkwell St,100
172.5936365,-43.29314298,44242,Ashley St near Coldstream Rd,B
172.7185721,-43.50129981,39144,Keyes Rd near Gresham Tce,60
172.566433,-43.56244,51093,Aidenfield (near McMahon Dr),60
172.5585383,-43.47919038,45761,Harewood Rd near Waimakariri Rd,125
172.7222,-43.605294,50810,Lyttelton Jetty,F
172.7197197,-43.60097518,42239,Winchester St near Coleridge Tce,155|28
172.7303726,-43.50549168,18235,Marine Pde near Hawke St,135
172.6198961,-43.51023312,12483,Papanui Rd near Murray Pl,100|95|B
172.579179,-43.563093,54124,Halswell Rd near Augustine Drive,60|O
172.6160997,-43.53112416,17253,Riccarton Ave,80|86|87|P|Y
172.7298089,-43.516785,26041,Union St near Mountbatten St,60
172.5312672,-43.5430845,38994,Main South Rd near Canterbury St,87|Y
172.6022288,-43.4942924,37436,Harewood Rd near Marble Wood Dr,125|28|Or
172.6949694,-43.47536567,20240,Queenspark Dr near Chadlington St,O
172.55223,-43.54014982,17847,Main South Rd,100|80|87|Y
172.6877515,-43.55175956,15744,Ferry Rd near Palinurus Rd,155|P
172.538504,-43.570202,53641,Knights Stream Park,O
172.5583879,-43.49866945,17538,Memorial Ave near Avice Hill Reserve,125|29|P
172.6232288,-43.52095452,16343,Carlton Mill Rd near Exeter St,17
172.6662,-43.3195,54512,Main North Rd near Woodend Rd,95
172.5962808,-43.55283017,44177,Lincoln Rd near Domain Tce,O
172.5173122,-43.54434336,17488,Main South Rd near Seymour St,130|Y
172.564867,-43.492634,51212,Roydvale Ave near Highwood Ln,P
172.7017036,-43.55740564,15621,Ferrymead Shops,140|155|P
172.6830987,-43.48228794,18371,Burwood Hospital - Mairehau Rd,135|O
172.6397116,-43.52467055,14302,Manchester St near Salisbury St,28|29|44|95|B
172.5158036,-43.53999757,14919,Gilberthorpes Rd near Gregory Ave,130
172.6679546,-43.54370253,23509,Ferry Rd near Manning Pl,P
172.4722344,-43.55181301,41353,Templeton,Y
172.6270937,-43.4765187,29963,Grimseys Rd near Mulberry Pl,125
172.6099849,-43.52903245,17932,Riccarton Rd near Bartlett St,130|80|86|87|P|Y
172.5699277,-43.5888377,33780,Halswell Rd near Larsens Rd,100
172.5542017,-43.51412677,10233,Withells Rd near Gainford St,125|P
172.6365173,-43.52412758,14413,Colombo St near Salisbury St,28
172.6865022,-43.51717938,18108,Wainoni Rd near Ottawa Rd,80
172.6531886,-43.39136535,43528,Williams St near Courtenay Drive,95|B
172.64695,-43.49558455,36739,Innes Rd near Hills Rd,44|Or
172.694189,-43.535332,51721,Maces Rd near Lupins Ln,155
172.6321585,-43.44521468,12034,Main North Rd near Richill St,95|B
172.6061179,-43.52701597,10953,Kilmarnock St near Harakeke St,130
172.4090924,-43.57870091,50102,Jones Rd near Weedons Ross Rd,Y
172.6020476,-43.53126671,11949,Clarence St near Peverel St,120|Or
172.7195412,-43.50983781,26485,Pages Rd near Waitaki St,Y
172.7307892,-43.51817605,26693,Union St,60
172.5333777,-43.52884533,24688,Carmen Rd near Steadman Rd,125|140
172.5886947,-43.52387618,13254,Clyde Rd near Arts Rd,100|120
172.5883664,-43.50057335,16520,Wairakei Rd near Manor Pl,17
172.6639187,-43.36971183,13811,Main North Rd near Williams St,95
172.6968,-43.314822,50932,Pegasus Blvd near Pegasus Main St,95
172.610407,-43.499904,13489,Papanui Rd near Grants Rd,95|B
172.6241556,-43.51530013,12844,Papanui Rd near Webb St,95|B
172.738228,-43.53619188,26686,Estuary Rd near Halsey St,60
172.6392915,-43.3842615,53401,Island Rd near Barnard St,B
172.553979,-43.551961,53897,Corsair Dr near Keene St,100
172.674139,-43.55238479,23827,Radley St near Sheldon St,155
172.36408,-43.610231,52839,Rolleston Terminus,Y
172.7289328,-43.50630725,53486,Hawke St near Keppel St,60
172.7166215,-43.56961219,32237,Major Hornbrook Rd near Belleview Tce,140
172.5157344,-43.54293312,14179,Parker St near Steele St,130
172.5632547,-43.57974646,14727,Oakridge St near Nicholls Rd,125|O
172.6849712,-43.51879042,18165,Wainoni Rd near Cuffs Rd,80
172.6236449,-43.55111794,29111,Selwyn St near Bletsoe Ave,60
172.5289261,-43.53700354,24931,Carmen Rd near Waterloo Rd,125|140
172.7433152,-43.54050594,26324,Rocking Horse Rd near Godwit St,60
172.72096,-43.603745,41812,Norwich Quay near Canterbury St,155|28
172.6368557,-43.54928768,23891,Colombo St near Walton St,45|B
172.420386,-43.64239092,50269,Ellesmere Junction Rd near Mather Pl,820
172.6026708,-43.5791924,33459,Penruddock Rse near Pembridge Ln,45
172.6997732,-43.30490521,54391,Pegasus,95
172.6235135,-43.47863166,29916,Daniels Rd near Mottram St,125
172.6679642,-43.53910569,37853,Aldwins Rd near Bass St,140|Or
172.6676646,-43.31782983,44469,Main North Rd near Hewitts Rd,95
172.6867155,-43.51715844,18177,Wainoni Rd near Ottawa Rd,80
172.6090279,-43.49840988,13491,Papanui Rd near Bellvue Ave,95|B
172.6312535,-43.44707929,15936,Main North Rd near Donegal St,95|B
172.426406,-43.644033,53878,Springston,87
172.5872597,-43.49844066,37709,Greers Rd near Saffron St,Or
172.5945995,-43.49081167,37462,Harewood Rd near Greers Rd,125|28|Or
172.6080633,-43.54452104,37594,Whiteleigh Ave near Jack Hinton Dr,120|Or
172.559685,-43.554525,54107,Skyhawk Rd near Kittyhawk Avenue,60
172.5991464,-43.50669912,16764,Wairakei Rd near Blighs Rd,17
172.718876,-43.603247,40750,Norwich Qy near Dublin St,155|28
172.5277469,-43.54726876,38236,Amyes Rd near Branston St,125
172.5562111,-43.49699196,17085,Memorial Ave near Stableford Green,125|29|P
172.6000959,-43.52626362,10100,Kahu Rd near Titoki St,130
172.547029,-43.53309804,24473,Racecourse Rd near O'briens Rd,130
172.6616761,-43.49549736,43954,Marshland Rd near Cotton St,135|60
172.6297287,-43.5233546,14829,Victoria St near Montreal St,29|95|B
172.665541,-43.471644,54410,Prestons School,135
172.6119187,-43.52283659,17419,Fendalton Rd near Wood Ln,29
172.6886853,-43.51497458,18183,Wainoni Rd near Avonside Dr,80
172.5675224,-43.57753276,38034,Halswell Rd,100|O
172.5269125,-43.53012189,14770,Hei Hei Rd near Buchanans Rd,130
172.6565505,-43.49888318,24193,Emmett St near Bellbrook Cres,44
172.5224722,-43.53355109,14791,Manurere St near Ranui St,130
172.6728993,-43.50761652,36794,Cresswell Ave near Gayhurst Rd,44
172.5294212,-43.53064697,42512,Buchanans Rd near Vanguard Dr,130
172.558448,-43.53387376,25401,Craven St near Algidus St,130
172.701068,-43.608713,41191,Park Tce near Cressy Tce,28
172.5813043,-43.51959475,32318,Creyke Rd near Barlow St,100|130
172.5446666,-43.53539909,14200,Buchanans Rd near Racecourse Rd,130
172.6252522,-43.53982346,14373,Moorhouse Ave near Stewart St,140
172.6210525,-43.51148955,38580,Merivale Mall,100|95|B
172.6092161,-43.55553884,33693,Cobham St near Clent Ln,120
172.6702875,-43.54458836,44385,Ferry Rd near Mackworth St,P
172.7193485,-43.50483064,39464,Keyes Rd near Rawson St,60
172.548848,-43.550359,51525,Corsair Dr near Gallaghan Cl,100
172.6217525,-43.54822732,43487,Selwyn St Shops,120|60
172.631552,-43.524406,52887,Salisbury St near Victoria St,29|95|B
172.6849573,-43.51862315,18392,Wainoni Rd near Cuffs Rd,80
172.6488191,-43.55246365,32696,Waltham Rd near Bunyan St,17
172.6365302,-43.53841926,14974,South City (Northbound),28|45|B
172.682645,-43.52033336,18430,Wainoni Rd near Pannell Ave,80
172.5662462,-43.56992306,38113,Dunbars Rd near Balkwell St,100
172.52837,-43.54329884,39003,Main South Rd near Tower St,87|Y
172.575119,-43.56698062,12719,Halswell Rd near Nash Rd,O
172.6663611,-43.3338071,12270,Main North Rd near Woodend Beach Rd,95
172.6884588,-43.49701678,39591,Bassett St near Parnwell St,60
172.7062993,-43.50398327,18448,Wainoni Rd near Bexley Rd,80
172.6851577,-43.50017793,39536,New Brighton Rd near Lake Terrace Rd,60
172.4198468,-43.64221315,50295,Ellesmere Junction Rd near Mather Pl,820
172.6325336,-43.44511882,15927,Main North Rd near Richill St,95|B
172.729186,-43.558244,,Mt Pleasant Terminus,120|125|130|140|820|P|Y
172.6912051,-43.51244022,18469,Wainoni Rd near Shortland St,80
172.588731,-43.50781369,10625,Clyde Rd near Evatt St,120
172.6530786,-43.56430006,32872,Huntsbury Ave near Ramahana Rd,17
172.6194731,-43.55977629,37616,Frankleigh St near Alvarez Pl,120|60|Or
172.694984,-43.551737,51103,Ti Rakau Dr near Delta Wy,140
172.6615029,-43.49563392,12465,Marshland Rd near Cotton St,135|60
172.570305,-43.531474,24378,Yaldhurst Rd near Angela St,140|86
172.61236,-43.51486409,16583,Rossall St near Leinster Rd,17
172.5906231,-43.55598419,12630,Halswell Rd near Tankerville Rd,O
172.6817659,-43.52712916,40231,Buckleys Rd near Kerrs Rd,155|Y
172.6136449,-43.50340463,12863,Papanui Rd near Tomes Rd,95|B
172.5854524,-43.50035569,36597,Greers Rd near Brookside Tce,Or
172.6073768,-43.56221792,33104,Hoon Hay Rd near Maryhill Ave,60
172.644838,-43.54008123,14736,Moorhouse Ave near Washington Wy,140|17
172.6615786,-43.52978599,21024,Gloucester St near England St,Y
172.6632127,-43.4937659,13296,Lake Terrace Rd near Giles Pl,60
172.5847284,-43.52109361,32122,University - Creyke Rd,100|130
172.7465609,-43.54831989,46990,Rocking Horse Rd near Plover St,60
172.5715032,-43.50665124,17322,Memorial Ave near Grahams Rd,29
172.6371523,-43.56445316,23756,Colombo St near Thorrington Rd,B
172.6812425,-43.52187985,18482,Kerrs Rd near Traynor Ln,80
172.6754563,-43.50525246,39349,New Brighton Rd near Kingsford St,O
172.3077386,-43.61702835,50207,Godley Rd,820
172.6275056,-43.52024647,12546,Bealey Ave,95|B
172.6653692,-43.53609296,18495,Harrow St near Bordesley St,80
172.729977,-43.50496239,40277,Marine Pde near Hawke St,135
172.62017,-43.540094,33250,Moorhouse Ave near Selwyn St,140|O
172.6531862,-43.56767999,32926,Huntsbury Ave near Aotea Tce,17
172.378598,-43.584042,52700,Link Dve,820
172.6026356,-43.53553098,11268,Clarence St near Lyndon St,120|Or
172.6158114,-43.51988872,10687,Rossall St near Holmwood Rd,17
172.6414981,-43.52977493,30688,Gloucester St near Latimer Square,O|Y
172.6072882,-43.51083782,16084,Strowan Rd near Lloyd St,17
172.6369268,-43.55439223,23917,Colombo St near Boon St,B
172.7125338,-43.48644732,18584,Beach Rd near Bower Ave,135|80
172.5412244,-43.51910393,24619,Bentley St near Delaware Cres,125|140
172.6612941,-43.5411696,23521,Ferry Rd near Bordesley St,140|P
172.5992538,-43.49260427,42888,Harewood Rd near Wilmot St,125|28|Or
172.5716785,-43.50702147,40427,Memorial Ave near Grahams Rd,29
172.6547562,-43.53541243,18702,Tuam St near Phillips St,80
172.5686323,-43.49866217,10752,Whitby St near Everest St,120
172.3701297,-43.51761647,54499,Preston Downs Reserve,86
172.5667027,-43.52038001,13399,Solway Ave near Glenside Ave,130
172.5734061,-43.52558565,37404,Waimairi Rd near Athol Tce,Or
172.5562962,-43.57020207,22230,Westlake Dr near Hemingford Pl,125
172.5665006,-43.49389142,10924,Teesdale St near Deepdale St,120
172.6518528,-43.53545286,18718,Tuam St near Fitzgerald Ave,80
172.630988,-43.44697344,12047,Main North Rd near Donegal St,95|B
